{
 "id": "ilostat_labour_income_share",
 "title": "Labour income share of GDP, ILO SDG 10.4.1, 2004-2025",
 "description": "Per year: median and unweighted mean over countries, number of countries, and selected countries (ILO modelled estimates).",
 "built_by": "site_src/data_campaign.py",
 "register": "audit/data/sources-register.json",
 "sources": [
  {
   "id": "ilostat",
   "title": "ILOSTAT (via the rplumber API): labour income share, output per worker, productivity growth, unemployment, employment by economic activity and by occupation (ILO modelled estimates, Nov 2025)",
   "version": "indicator files as served 2026-10-22; modelled estimates Nov. 2025; SDG 10.4.1 last update 2026-03-20",
   "url": "https://rplumber.ilo.org/data/indicator/",
   "licence": "CC BY 4.0 (ILO data published as of 3 May 2023)",
   "licence_quote": "As of 3 May 2023, databases and datasets together with the accompanying referential metadata are covered by the Creative Commons CC BY 4.0 licence.",
   "redistribution": "yes"
  }
 ],
 "source_files": [
  {
   "path": "ilostat/SDG_1041_NOC_RT_A.csv",
   "sha256": "8a952c0b48cdf4078ebeaaf80ce9314086efa2a94938fb590225c25c0afb9e5a",
   "bytes": 1074848
  }
 ],
 "retrieved": "2026-10-22",
 "redistribution": "yes",
 "attribution": "ILOSTAT, SDG indicator 10.4.1 (labour income share as a percent of GDP), ILO modelled estimates, https://ilostat.ilo.org (CC BY 4.0 per ilo.org/rights-and-permissions).",
 "units": "% of GDP",
 "geography": "countries (3-letter ISO codes; aggregates excluded)",
 "time_span": "2004 to 2025",
 "variables": [
  "median_pct",
  "mean_pct",
  "n_countries",
  "selected_countries"
 ],
 "supports": [
  "L4",
  "L7"
 ],
 "method": "Rows of SDG_1041_NOC_RT_A.csv with a 3-letter ref_area; years 2004-2025 (2026 is a projection/imputation and dropped).",
 "caveats": [
  "The series starts in 2004 (confirms D-008's note) and is modelled for many countries; PWT labsh is the long series.",
  "The ILO measure and PWT labsh differ in definition (ILO: labour compensation including an imputation for self-employed, as % of GDP at factor cost/market prices per national source)."
 ],
 "data": {
  "by_year": [
   {
    "year": 2004,
    "n_countries": 189,
    "median_pct": 46.012,
    "mean_pct": 45.907
   },
   {
    "year": 2005,
    "n_countries": 189,
    "median_pct": 46.265,
    "mean_pct": 45.612
   },
   {
    "year": 2006,
    "n_countries": 189,
    "median_pct": 45.67,
    "mean_pct": 45.29
   },
   {
    "year": 2007,
    "n_countries": 189,
    "median_pct": 45.246,
    "mean_pct": 45.391
   },
   {
    "year": 2008,
    "n_countries": 189,
    "median_pct": 45.312,
    "mean_pct": 45.438
   },
   {
    "year": 2009,
    "n_countries": 189,
    "median_pct": 47.071,
    "mean_pct": 46.781
   },
   {
    "year": 2010,
    "n_countries": 189,
    "median_pct": 46.024,
    "mean_pct": 45.885
   },
   {
    "year": 2011,
    "n_countries": 189,
    "median_pct": 45.679,
    "mean_pct": 45.717
   },
   {
    "year": 2012,
    "n_countries": 189,
    "median_pct": 46.231,
    "mean_pct": 46.036
   },
   {
    "year": 2013,
    "n_countries": 189,
    "median_pct": 46.887,
    "mean_pct": 46.22
   },
   {
    "year": 2014,
    "n_countries": 189,
    "median_pct": 47.281,
    "mean_pct": 46.508
   },
   {
    "year": 2015,
    "n_countries": 189,
    "median_pct": 46.876,
    "mean_pct": 46.867
   },
   {
    "year": 2016,
    "n_countries": 189,
    "median_pct": 46.798,
    "mean_pct": 46.854
   },
   {
    "year": 2017,
    "n_countries": 189,
    "median_pct": 46.467,
    "mean_pct": 46.483
   },
   {
    "year": 2018,
    "n_countries": 189,
    "median_pct": 46.187,
    "mean_pct": 46.418
   },
   {
    "year": 2019,
    "n_countries": 189,
    "median_pct": 46.277,
    "mean_pct": 46.601
   },
   {
    "year": 2020,
    "n_countries": 189,
    "median_pct": 47.267,
    "mean_pct": 47.601
   },
   {
    "year": 2021,
    "n_countries": 189,
    "median_pct": 45.433,
    "mean_pct": 45.833
   },
   {
    "year": 2022,
    "n_countries": 188,
    "median_pct": 45.614,
    "mean_pct": 45.492
   },
   {
    "year": 2023,
    "n_countries": 186,
    "median_pct": 45.9,
    "mean_pct": 46.057
   },
   {
    "year": 2024,
    "n_countries": 184,
    "median_pct": 46.06,
    "mean_pct": 46.26
   },
   {
    "year": 2025,
    "n_countries": 184,
    "median_pct": 46.23,
    "mean_pct": 46.337
   }
  ],
  "selected_countries": {
   "USA": {
    "years": [
     2004,
     2005,
     2006,
     2007,
     2008,
     2009,
     2010,
     2011,
     2012,
     2013,
     2014,
     2015,
     2016,
     2017,
     2018,
     2019,
     2020,
     2021,
     2022,
     2023,
     2024,
     2025
    ],
    "pct": [
     62.01,
     61.055,
     60.895,
     60.906,
     60.854,
     59.791,
     58.758,
     58.675,
     58.537,
     57.917,
     58.089,
     58.582,
     58.399,
     58.398,
     58.397,
     58.2,
     59.091,
     57.926,
     56.163,
     55.385,
     55.452,
     55.807
    ]
   },
   "CHN": {
    "years": [
     2004,
     2005,
     2006,
     2007,
     2008,
     2009,
     2010,
     2011,
     2012,
     2013,
     2014,
     2015,
     2016,
     2017,
     2018,
     2019,
     2020,
     2021,
     2022,
     2023,
     2024,
     2025
    ],
    "pct": [
     51.455,
     51.104,
     50.741,
     50.331,
     51.423,
     51.45,
     51.112,
     51.348,
     51.734,
     51.731,
     51.666,
     51.613,
     51.515,
     51.345,
     51.241,
     51.419,
     51.758,
     50.977,
     51.602,
     51.062,
     51.165,
     51.228
    ]
   },
   "DEU": {
    "years": [
     2004,
     2005,
     2006,
     2007,
     2008,
     2009,
     2010,
     2011,
     2012,
     2013,
     2014,
     2015,
     2016,
     2017,
     2018,
     2019,
     2020,
     2021,
     2022,
     2023,
     2024,
     2025
    ],
    "pct": [
     62.006,
     61.555,
     59.78,
     58.419,
     59.044,
     62.168,
     60.682,
     60.542,
     61.467,
     61.619,
     61.394,
     61.626,
     61.399,
     61.635,
     62.191,
     62.669,
     63.021,
     61.465,
     60.139,
     60.531,
     62.042,
     63.107
    ]
   },
   "JPN": {
    "years": [
     2004,
     2005,
     2006,
     2007,
     2008,
     2009,
     2010,
     2011,
     2012,
     2013,
     2014,
     2015,
     2016,
     2017,
     2018,
     2019,
     2020,
     2021,
     2022,
     2023,
     2024,
     2025
    ],
    "pct": [
     53.715,
     54.041,
     54.614,
     54.349,
     55.484,
     56.211,
     54.368,
     55.233,
     54.821,
     54.133,
     53.62,
     52.395,
     52.879,
     52.748,
     54.364,
     55.1,
     56.322,
     56.215,
     56.321,
     54.351,
     54.809,
     54.409
    ]
   },
   "IND": {
    "years": [
     2004,
     2005,
     2006,
     2007,
     2008,
     2009,
     2010,
     2011,
     2012,
     2013,
     2014,
     2015,
     2016,
     2017,
     2018,
     2019,
     2020,
     2021,
     2022,
     2023,
     2024,
     2025
    ],
    "pct": [
     59.128,
     57.163,
     54.781,
     54.484,
     59.975,
     61.553,
     59.346,
     58.128,
     57.299,
     57.365,
     58.568,
     57.585,
     58.485,
     58.989,
     59.827,
     60.332,
     62.607,
     62.346,
     62.027,
     61.141,
     61.925,
     61.825
    ]
   },
   "FRA": {
    "years": [
     2004,
     2005,
     2006,
     2007,
     2008,
     2009,
     2010,
     2011,
     2012,
     2013,
     2014,
     2015,
     2016,
     2017,
     2018,
     2019,
     2020,
     2021,
     2022,
     2023,
     2024,
     2025
    ],
    "pct": [
     59.982,
     60.645,
     60.968,
     62.076,
     60.606,
     62.209,
     62.903,
     62.638,
     62.095,
     61.34,
     63.305,
     62.169,
     61.977,
     60.018,
     60.193,
     59.755,
     60.799,
     59.681,
     60.597,
     59.691,
     60.04,
     59.996
    ]
   },
   "GBR": {
    "years": [
     2004,
     2005,
     2006,
     2007,
     2008,
     2009,
     2010,
     2011,
     2012,
     2013,
     2014,
     2015,
     2016,
     2017,
     2018,
     2019,
     2020,
     2021,
     2022,
     2023,
     2024,
     2025
    ],
    "pct": [
     58.623,
     58.593,
     58.761,
     59.72,
     59.096,
     59.532,
     58.832,
     57.733,
     57.499,
     57.103,
     56.915,
     56.176,
     56.232,
     55.815,
     55.865,
     56.166,
     59.631,
     57.401,
     55.691,
     55.866,
     56.406,
     57.704
    ]
   },
   "BRA": {
    "years": [
     2004,
     2005,
     2006,
     2007,
     2008,
     2009,
     2010,
     2011,
     2012,
     2013,
     2014,
     2015,
     2016,
     2017,
     2018,
     2019,
     2020,
     2021,
     2022,
     2023,
     2024,
     2025
    ],
    "pct": [
     55.27,
     56.1,
     57.343,
     56.023,
     56.702,
     58.4,
     57.12,
     57.538,
     57.796,
     58.95,
     59.592,
     61.387,
     61.222,
     61.166,
     60.472,
     60.445,
     58.221,
     57.937,
     59.414,
     59.448,
     59.281,
     59.5
    ]
   },
   "KOR": {
    "years": [
     2004,
     2005,
     2006,
     2007,
     2008,
     2009,
     2010,
     2011,
     2012,
     2013,
     2014,
     2015,
     2016,
     2017,
     2018,
     2019,
     2020,
     2021,
     2022,
     2023,
     2024,
     2025
    ],
    "pct": [
     57.039,
     57.939,
     58.366,
     57.556,
     57.304,
     56.532,
     54.679,
     55.401,
     55.914,
     56.106,
     56.824,
     57.013,
     56.593,
     56.223,
     57.099,
     58.687,
     59.226,
     57.469,
     58.278,
     58.77,
     58.128,
     58.681
    ]
   }
  }
 }
}
